"UNIPROT","Symbol","logFC","adj.P.Val","degree","betweenness","CDS","rank_base","rank_sd","rank_min","rank_max","robustness_label","Symbol_biomat","Protein_Description","GO_BP","GO_CC","GO_MF","Theme_Vesicle_Trafficking","Theme_Motility_Signaling","Theme_Cell_Adhesion","Theme_Immune_Evasion","Num_Themes_Match","Localization","PubMed_hits"
"P30153","PPP2R1A",0.691686750544797,0.0383105738920348,2,0,0.114068276710325,61,0.66,61,63,"robust_candidate","PPP2R1A","protein phosphatase 2 scaffold subunit Aalpha [Source:HGNC Symbol;Acc:HGNC:9302]","regulation of cell differentiation; intracellular signal transduction; chromosome segregation; meiotic sister chromatid cohesion, centromeric; negative regulation of hippo signaling; transcription by RNA polymerase II; regulation of growth; protein-containing complex assembly; female meiotic nuclear division; meiotic spindle elongation; mitotic sister chromatid separation; regulation of meiotic cell cycle process involved in oocyte maturation; positive regulation of extrinsic apoptotic signaling pathway in absence of ligand; T cell homeostasis; negative regulation of phosphatidylinositol 3-kinase/protein kinase B signal transduction; transcription elongation by RNA polymerase II; spindle assembly","nucleus; cytoplasm; plasma membrane; membrane; cell projection; mitochondrion; cytosol; chromosome; dendrite; FAR/SIN/STRIPAK complex; chromosome, centromeric region; neuron projection; microtubule cytoskeleton; neuronal cell body; chromatin; synapse; glutamatergic synapse","protein binding; protein heterodimerization activity; protein phosphatase regulator activity; protein serine/threonine phosphatase activity; protein antigen binding",FALSE,FALSE,FALSE,FALSE,0,"membrane",1
"P31431","SDC4",3.50413506464376,0.0042667087774112,6,0,0.461815906048611,19,1.21,16,22,"robust_candidate","SDC4","syndecan 4 [Source:HGNC Symbol;Acc:HGNC:10661]","positive regulation of exosomal secretion; cell migration; positive regulation of extracellular exosome assembly; neural tube closure; wound healing; inner ear receptor cell stereocilium organization; ureteric bud development; negative regulation of T cell proliferation; positive regulation of stress fiber assembly; positive regulation of focal adhesion assembly","membrane; extracellular region; plasma membrane; lysosomal lumen; Golgi lumen; focal adhesion; costamere","protein binding; identical protein binding; fibronectin binding; protein kinase C binding",TRUE,TRUE,TRUE,FALSE,3,"extracellular",12
"P31948","STIP1",0.536782178550087,0.124351699438238,8,95,0.199499177470171,45,0.83,45,47,"robust_candidate","STIP1","stress induced phosphoprotein 1 [Source:HGNC Symbol;Acc:HGNC:11387]","","nucleus; cytoplasm; protein-containing complex; protein folding chaperone complex; cytosol; Golgi apparatus","protein binding; RNA binding; Hsp90 protein binding",FALSE,FALSE,FALSE,FALSE,0,"intracellular",2
"P35579","MYH9",0.437691410362646,0.0911323355978355,14,199.494337144337,0.237194085907899,42,0.31,41,42,"robust_candidate","MYH9","myosin heavy chain 9 [Source:HGNC Symbol;Acc:HGNC:7579]","protein transport; membrane protein ectodomain proteolysis; cell adhesion; angiogenesis; regulation of cell shape; plasma membrane repair; actin cytoskeleton organization; integrin-mediated signaling pathway; cytoskeleton organization; regulated exocytosis; leukocyte migration; symbiont entry into host cell; cytokinetic process; regulation of actin filament-based process; actomyosin structure organization; lysosome localization; actin filament-based movement; blood vessel endothelial cell migration; monocyte differentiation; platelet formation; phagocytosis, engulfment; positive regulation of protein processing in phagocytic vesicle; regulation of plasma membrane repair; meiotic spindle organization; in utero embryonic development; establishment of T cell polarity; myoblast fusion; uropod organization; cell motility; establishment of meiotic spindle localization; cytoplasmic actin-based contraction involved in cell motility; cell-cell adhesion; cell morphogenesis; endodermal cell differentiation; cortical granule exocytosis; negative regulation of actin filament severing","myosin complex; nucleus; cytoplasm; plasma membrane; membrane; cytosol; cytoskeleton; focal adhesion; nuclear body; cytoplasmic vesicle; actin cytoskeleton; stress fiber; COP9 signalosome; cell cortex; protein-containing complex; ruffle; cell leading edge; cortical granule; supramolecular fiber; myosin II complex; myosin filament; actomyosin; immunological synapse; uropod; Golgi apparatus; spindle; actomyosin contractile ring; brush border; adherens junction; cytoplasmic side of plasma membrane; cortical cytoskeleton; neuromuscular junction; myosin II filament","ATP binding; protein binding; actin filament binding; cytoskeletal motor activity; RNA binding; nucleotide binding; actin binding; calmodulin binding; integrin binding; protein homodimerization activity; identical protein binding; virus receptor activity; protein domain specific binding; microfilament motor activity; cadherin binding; protein-membrane adaptor activity; ADP binding",TRUE,TRUE,TRUE,TRUE,4,"membrane",7
"P35613","BSG",0.453520325806487,0.0549877346132674,4,0,0.121466522872591,60,0,60,60,"robust_candidate","BSG","basigin (Ok blood group) [Source:HGNC Symbol;Acc:HGNC:1116]","angiogenesis; symbiont entry into host cell; neutrophil chemotaxis; protein localization to plasma membrane; cell surface receptor signaling pathway; axon guidance; homophilic cell adhesion via plasma membrane adhesion molecules; dendrite self-avoidance; neuron projection extension; embryo implantation; odontogenesis of dentin-containing tooth; response to peptide hormone; response to mercury ion; decidualization; response to cAMP; neural retina development; positive regulation of endothelial cell migration; positive regulation of viral entry into host cell; endothelial tube morphogenesis; positive regulation of matrix metallopeptidase secretion","plasma membrane; membrane; cell projection; endosome; mitochondrion; focal adhesion; endoplasmic reticulum; endoplasmic reticulum membrane; photoreceptor outer segment; photoreceptor inner segment; axon; acrosomal membrane","protein binding; carbohydrate binding; D-mannose binding; virus receptor activity; signaling receptor activity; cadherin binding; cell-cell adhesion mediator activity",FALSE,TRUE,TRUE,FALSE,2,"membrane",11
"P43121","MCAM",4.39409970059906,0.000912067993950594,4,1.40725108225108,0.552547131619038,11,0.64,10,12,"robust_candidate","MCAM","melanoma cell adhesion molecule [Source:HGNC Symbol;Acc:HGNC:6934]","cell adhesion; glomerular filtration; angiogenesis; anatomical structure morphogenesis; vascular wound healing; positive regulation of cell migration","membrane; focal adhesion; plasma membrane; extracellular region; extracellular space","protein binding; laminin receptor activity",FALSE,TRUE,TRUE,FALSE,2,"extracellular",9
"P51149","RAB7A",0.297997833210797,0.199740744985599,6,0,0.109773908466247,62,0.45,61,63,"robust_candidate","RAB7A","RAB7A, member RAS oncogene family [Source:HGNC Symbol;Acc:HGNC:9788]","lipid metabolic process; lipid catabolic process; autophagy; early endosome to late endosome transport; protein transport; retrograde transport, endosome to Golgi; positive regulation of exosomal secretion; autophagosome assembly; response to bacterium; protein localization to lysosome; phagosome-lysosome fusion; negative regulation of exosomal secretion; negative regulation of intralumenal vesicle formation; endosome to lysosome transport; protein to membrane docking; endocytosis; positive regulation of protein catabolic process; protein targeting to lysosome; epidermal growth factor catabolic process; viral release from host cell; positive regulation of viral process; lipophagy; phagosome maturation; phagosome acidification; establishment of vesicle localization; vesicle-mediated transport in synapse","membrane; cytosol; endosome; endosome membrane; mitochondrion; cytoplasmic vesicle; mitochondrial membrane; lysosome; late endosome; lysosomal membrane; phagocytic vesicle membrane; lipid droplet; plasma membrane; late endosome membrane; melanosome membrane; phagocytic vesicle; retromer complex; bounding membrane of organelle; autophagosome membrane; secretory granule membrane; synaptic vesicle membrane; glutamatergic synapse; cytoplasm; Golgi apparatus; phagophore assembly site membrane; alveolar lamellar body","GTPase activity; GTP binding; protein binding; hydrolase activity; nucleotide binding; G protein activity; retromer complex binding; GDP binding; small GTPase binding",TRUE,FALSE,FALSE,FALSE,1,"membrane",15
"P52292","KPNA2",1.49840356038263,0.0283347449377956,2,0,0.192079363218904,48,2.11,44,51,"weight_sensitive_candidate","KPNA2","karyopherin subunit alpha 2 [Source:HGNC Symbol;Acc:HGNC:6395]","protein import into nucleus; protein transport; positive regulation of DNA-templated transcription; entry of viral genome into host nucleus through nuclear pore complex via importin; positive regulation of viral life cycle; NLS-bearing protein import into nucleus; DNA metabolic process; regulation of DNA recombination","cytoplasm; nucleus; membrane; Golgi apparatus; cytosol; nucleoplasm; endoplasmic reticulum; endoplasmic reticulum membrane; nuclear membrane; host cell","protein binding; nuclear import signal receptor activity; RNA binding; nuclear localization sequence binding; histone deacetylase binding",FALSE,FALSE,FALSE,FALSE,0,"intracellular",4
"P52565","ARHGDIA",0.854389730062699,0.0170958130397314,4,0,0.176388726386393,51,1.39,50,54,"robust_candidate","ARHGDIA","Rho GDP dissociation inhibitor alpha [Source:HGNC Symbol;Acc:HGNC:678]","Rho protein signal transduction; negative regulation of apoptotic process; regulation of Rho protein signal transduction; semaphorin-plexin signaling pathway; regulation of protein localization","cytoplasm; cytoskeleton; membrane; cytosol; immunological synapse; nucleus","protein binding; Rho GDP-dissociation inhibitor activity; GTPase activator activity",FALSE,TRUE,FALSE,FALSE,1,"intracellular",0
"P54652","HSPA2",-0.454695232590478,0.210896570971856,2,0,0.065495591768782,71,0.45,69,71,"robust_candidate","HSPA2","heat shock protein family A (Hsp70) member 2 [Source:HGNC Symbol;Acc:HGNC:5235]","response to cold; cell differentiation; spermatogenesis; response to unfolded protein; negative regulation of inclusion body assembly; response to heat; male meiotic nuclear division; spermatid development; male meiosis I; positive regulation of G2/M transition of mitotic cell cycle","nucleus; cytoplasm; membrane; cytosol; cytoskeleton; spindle; plasma membrane; blood microparticle; meiotic spindle; synaptonemal complex; male germ cell nucleus","ATP binding; enzyme binding; nucleotide binding; protein binding; unfolded protein binding; ATP hydrolysis activity; protein folding chaperone; disordered domain specific binding; heat shock protein binding; tau protein binding; protein-folding chaperone binding; glycolipid binding",FALSE,FALSE,FALSE,FALSE,0,"membrane",2
"P54725","RAD23A",-0.00389867251994147,0.992709140420354,2,0,0,73,0,73,73,"robust_candidate","RAD23A","RAD23 homolog A, nucleotide excision repair protein [Source:HGNC Symbol;Acc:HGNC:9812]","nucleotide-excision repair; proteasome-mediated ubiquitin-dependent protein catabolic process; DNA repair; DNA damage response; positive regulation of cell cycle; regulation of proteasomal ubiquitin-dependent protein catabolic process; positive regulation of viral genome replication; protein destabilization; UV-damage excision repair; positive regulation of proteasomal ubiquitin-dependent protein catabolic process","nucleus; cytosol; nucleoplasm; Golgi apparatus; proteasome complex; protein-containing complex; cytoplasm","protein binding; damaged DNA binding; polyubiquitin modification-dependent protein binding; single-stranded DNA binding; ubiquitin binding; proteasome binding; ubiquitin-specific protease binding; kinase binding",FALSE,FALSE,FALSE,FALSE,0,"intracellular",1
"P55268","LAMB2",2.97025364331254,0.00696998449304999,16,0.333333333333333,0.468667857340103,18,0.57,17,19,"robust_candidate","LAMB2","laminin subunit beta 2 [Source:HGNC Symbol;Acc:HGNC:6487]","cell adhesion; positive regulation of cell adhesion; positive regulation of muscle cell differentiation; regulation of basement membrane organization; positive regulation of integrin-mediated signaling pathway; cell morphogenesis; axon guidance; neuromuscular junction development; visual perception; astrocyte development; Schwann cell development; neuron projection development; axon extension involved in regeneration; synapse organization; radial glial cell differentiation; retina development in camera-type eye; metanephric podocyte development; metanephric glomerular basement membrane development","extracellular region; basement membrane; laminin-3 complex; extracellular matrix; endoplasmic reticulum lumen; laminin-11 complex; protein complex involved in cell-matrix adhesion; neuromuscular junction; synaptic cleft; synapse; laminin complex","protein binding; extracellular matrix structural constituent; structural molecule activity; integrin binding; structural constituent of synapse-associated extracellular matrix",FALSE,FALSE,TRUE,FALSE,1,"extracellular",3
"P61088","UBE2N",1.00647390740892,0.181752591730059,4,95,0.196125861999164,46,0.94,45,48,"robust_candidate","UBE2N","ubiquitin conjugating enzyme E2 N [Source:HGNC Symbol;Acc:HGNC:12492]","protein ubiquitination; DNA repair; DNA damage response; protein polyubiquitination; proteasome-mediated ubiquitin-dependent protein catabolic process; negative regulation of TORC1 signaling; T cell receptor signaling pathway; cellular response to nutrient levels; TORC1 signaling; positive regulation of NF-kappaB transcription factor activity; positive regulation of double-strand break repair; double-strand break repair via homologous recombination; postreplication repair; DNA double-strand break processing; ubiquitin-dependent protein catabolic process; regulation of DNA repair; protein monoubiquitination; positive regulation of canonical NF-kappaB signal transduction; positive regulation of DNA repair; positive regulation of protein K63-linked ubiquitination; positive regulation of intracellular signal transduction","nucleus; cytoplasm; nucleoplasm; ubiquitin ligase complex; cytosol; UBC13-MMS2 complex; protein-containing complex; ubiquitin conjugating enzyme complex","RNA binding; transferase activity; nucleotide binding; ATP binding; protein binding; ubiquitin protein ligase binding; ubiquitin-protein transferase activity; ubiquitin conjugating enzyme activity; ubiquitin binding; ubiquitin-protein transferase activator activity",FALSE,FALSE,FALSE,FALSE,0,"intracellular",3
"P61586","RHOA",0.893185020661484,0.0209950607597007,30,383.669891367871,0.357414616980802,26,1.27,24,29,"robust_candidate","RHOA","ras homolog family member A [Source:HGNC Symbol;Acc:HGNC:667]","small GTPase-mediated signal transduction; cell division; mitotic cytokinesis; positive regulation of cell migration; wound healing, spreading of cells; skeletal muscle satellite cell migration; cell migration; positive regulation of canonical NF-kappaB signal transduction; regulation of cell migration; actin cytoskeleton organization; Roundabout signaling pathway; negative chemotaxis; regulation of actin cytoskeleton organization; cellular response to lipopolysaccharide; Rho protein signal transduction; cell junction assembly; cleavage furrow formation; positive regulation of protein serine/threonine kinase activity; establishment of epithelial cell apical/basal polarity; substantia nigra development; stress fiber assembly; positive regulation of T cell migration; positive regulation of non-canonical NF-kappaB signal transduction; positive regulation of cytokinesis; Wnt signaling pathway, planar cell polarity pathway; semaphorin-plexin signaling pathway; mitotic spindle assembly; substrate adhesion-dependent cell spreading; ossification involved in bone maturation; apical junction assembly; endothelial cell migration; cellular response to cytokine stimulus; positive regulation of leukocyte adhesion to vascular endothelial cell; positive regulation of lipase activity; regulation of focal adhesion assembly; aortic valve formation; positive regulation of stress fiber assembly; positive regulation of neuron differentiation; negative regulation of cell migration involved in sprouting angiogenesis; endothelial tube lumen extension; negative regulation of cell-substrate adhesion; cytoplasmic microtubule organization; regulation of osteoblast proliferation; bone trabecula morphogenesis; regulation of modification of postsynaptic structure; mitotic cleavage furrow formation; regulation of modification of postsynaptic actin cytoskeleton; cellular response to chemokine; motor neuron apoptotic process; cell morphogenesis; neuron migration; kidney development; angiotensin-mediated vasoconstriction involved in regulation of systemic arterial blood pressure; regulation of systemic arterial blood pressure by endothelin; regulation of transcription by RNA polymerase II; cytoskeleton organization; cell adhesion; cell-matrix adhesion; skeletal muscle tissue development; regulation of neuron projection development; cerebral cortex cell migration; forebrain radial glial cell differentiation; cell differentiation; androgen receptor signaling pathway; negative regulation of intracellular steroid hormone receptor signaling pathway; positive regulation of podosome assembly; positive regulation of vascular associated smooth muscle contraction; regulation of neural precursor cell proliferation; negative regulation of motor neuron apoptotic process; alpha-beta T cell lineage commitment; odontogenesis; beta selection; positive regulation of alpha-beta T cell differentiation; regulation of microtubule cytoskeleton organization; negative regulation of oxidative phosphorylation; negative regulation of reactive oxygen species biosynthetic process","nucleus; cytoplasm; plasma membrane; membrane; cell projection; cytosol; cytoskeleton; focal adhesion; dendrite; lamellipodium; midbody; cell cortex; cell periphery; endoplasmic reticulum membrane; cytoplasmic side of plasma membrane; apical junction complex; secretory granule membrane; cell junction; glutamatergic synapse; postsynapse; dendritic spine; vesicle; endosome","GTPase activity; GTP binding; protein binding; hydrolase activity; nucleotide binding; protein kinase binding; G protein activity; myosin binding",TRUE,TRUE,TRUE,TRUE,4,"membrane",63
"P61769","B2M",2.26227011810693,0.000165249161826686,2,0,0.34303414140783,29,1.48,26,31,"robust_candidate","B2M","beta-2-microglobulin [Source:HGNC Symbol;Acc:HGNC:914]","immune response; immune system process; antigen processing and presentation of peptide antigen via MHC class I; response to metal ion; positive regulation of T cell activation; positive regulation of receptor-mediated endocytosis; learning or memory; negative regulation of neurogenesis; antigen processing and presentation of exogenous peptide antigen via MHC class II; positive regulation of immune response; negative regulation of receptor-mediated endocytosis; transferrin transport; intracellular iron ion homeostasis; cellular response to iron ion; positive regulation of T cell cytokine production; antigen processing and presentation of endogenous peptide antigen via MHC class I; regulation of iron ion transport; negative regulation of iron ion transport; negative regulation of epithelial cell proliferation; protein homotetramerization; cellular response to nicotine; amyloid fibril formation; positive regulation of cellular senescence; negative regulation of forebrain neuron differentiation; T cell mediated cytotoxicity; positive regulation of T cell mediated cytotoxicity; response to molecule of bacterial origin; iron ion transport; negative regulation of neuron projection development; T cell differentiation in thymus; multicellular organismal-level iron ion homeostasis; cellular response to iron(III) ion; sensory perception of smell","extracellular region; extracellular space; membrane; cytosol; Golgi apparatus; plasma membrane; focal adhesion; endoplasmic reticulum; late endosome membrane; phagocytic vesicle membrane; HFE-transferrin receptor complex; endoplasmic reticulum lumen; specific granule lumen; tertiary granule lumen; ER to Golgi transport vesicle membrane; MHC class I peptide loading complex; lysosomal membrane; early endosome membrane; recycling endosome membrane; early endosome lumen","protein binding; structural molecule activity; identical protein binding; protein homodimerization activity; MHC class II protein complex binding",TRUE,FALSE,TRUE,TRUE,3,"extracellular",10
"P62826","RAN",0.501775249638168,0.181866091758819,6,95,0.173193935773952,52,0.51,51,53,"robust_candidate","RAN","RAN, member RAS oncogene family [Source:HGNC Symbol;Acc:HGNC:9846]","nucleocytoplasmic transport; glycolytic process; cell division; protein transport; mitotic spindle organization; mitotic sister chromatid segregation; protein import into nucleus; mitotic cell cycle; protein export from nucleus; GTP metabolic process; DNA metabolic process; ribosomal large subunit export from nucleus; ribosomal small subunit export from nucleus; viral process; ribosomal subunit export from nucleus; protein localization; actin cytoskeleton organization; protein-containing complex localization; spermatid development; hippocampus development; pre-miRNA export from nucleus; snRNA import into nucleus; cellular response to mineralocorticoid stimulus; protein localization to nucleolus","nucleus; cytoplasm; membrane; nucleoplasm; cytosol; nuclear envelope; nucleolus; midbody; centriole; protein-containing complex; nuclear pore; chromatin; recycling endosome; male germ cell nucleus; manchette","GTPase activity; GTP binding; protein binding; RNA binding; hydrolase activity; metal ion binding; nucleotide binding; chromatin binding; G protein activity; cadherin binding; GDP binding; protein heterodimerization activity; pre-miRNA binding; nuclear export signal receptor activity; protein domain specific binding; protein-containing complex binding; importin-alpha family protein binding",FALSE,TRUE,FALSE,FALSE,1,"vesicle/exosome",78
"P62873","GNB1",0.722785871677132,0.0497436684950498,6,6.14855275443511,0.189104903997156,49,0.45,48,50,"robust_candidate","GNB1","G protein subunit beta 1 [Source:HGNC Symbol;Acc:HGNC:4396]","signal transduction; G protein-coupled receptor signaling pathway; cellular response to prostaglandin E stimulus; Ras protein signal transduction; adenylate cyclase-activating dopamine receptor signaling pathway; cellular response to catecholamine stimulus; G protein-coupled acetylcholine receptor signaling pathway; phospholipase C-activating G protein-coupled receptor signaling pathway; cell population proliferation; sensory perception of taste; retina development in camera-type eye","heterotrimeric G-protein complex; lysosomal membrane; cytoplasm; plasma membrane; cytosol; extracellular vesicle; membrane; photoreceptor disc membrane; synapse; photoreceptor outer segment","protein binding; GTPase activity; protein-containing complex binding; signaling receptor complex adaptor activity; GTPase binding",TRUE,FALSE,FALSE,FALSE,1,"extracellular",0
"P62993","GRB2",0.34384955984094,0.349628977781601,10,45.9329684375512,0.172426487858588,53,1.02,50,53,"robust_candidate","GRB2","growth factor receptor bound protein 2 [Source:HGNC Symbol;Acc:HGNC:4566]","actin cytoskeleton organization; negative regulation of natural killer cell mediated cytotoxicity; T cell activation; epidermal growth factor receptor signaling pathway; signal transduction; T cell costimulation; Ras protein signal transduction; insulin receptor signaling pathway; regulation of MAPK cascade; positive regulation of reactive oxygen species metabolic process; signal transduction in response to DNA damage; receptor internalization; fibroblast growth factor receptor signaling pathway; positive regulation of actin filament polymerization; endodermal cell differentiation; negative regulation of epidermal growth factor receptor signaling pathway; anatomical structure formation involved in morphogenesis; branching involved in labyrinthine layer morphogenesis; Schwann cell development; myelination; insulin-like growth factor receptor signaling pathway; B cell receptor signaling pathway","nucleus; cytoplasm; Golgi apparatus; cytosol; endosome; centrosome; COP9 signalosome; plasma membrane; nucleoplasm; cell cortex; cell-cell junction; vesicle membrane; membrane","protein binding; RNA binding; identical protein binding; protein-macromolecule adaptor activity; ephrin receptor binding; protein domain specific binding; epidermal growth factor receptor binding; phosphotyrosine residue binding; protein kinase binding; insulin receptor substrate binding; neurotrophin TRKA receptor binding; guanyl-nucleotide exchange factor adaptor activity; transmembrane receptor protein tyrosine kinase adaptor activity; protein phosphatase binding",TRUE,TRUE,TRUE,FALSE,3,"membrane",9
"P67936","TPM4",-0.168809684631039,0.71889876674394,4,6.29484126984127,0.0737496712666727,69,0.39,68,70,"robust_candidate","TPM4","tropomyosin 4 [Source:HGNC Symbol;Acc:HGNC:12013]","osteoblast differentiation; actin filament organization; platelet formation; muscle contraction","cytoplasm; membrane; cytoskeleton; focal adhesion; muscle thin filament tropomyosin; cytosol; actin filament; stress fiber; podosome; cortical cytoskeleton","calcium ion binding; metal ion binding; actin binding; protein binding; identical protein binding; protein homodimerization activity; protein heterodimerization activity; actin filament binding; structural constituent of muscle",FALSE,FALSE,TRUE,FALSE,1,"intracellular",2
