"UNIPROT","Symbol","logFC","adj.P.Val","degree","betweenness","CDS","rank_base","rank_sd","rank_min","rank_max","robustness_label","Symbol_biomat","Protein_Description","GO_BP","GO_CC","GO_MF","Theme_Vesicle_Trafficking","Theme_Motility_Signaling","Theme_Cell_Adhesion","Theme_Immune_Evasion","Num_Themes_Match","Localization","PubMed_hits"
"P98160","HSPG2",2.11658801495104,0.000293919518724457,16,5.62285898855666,0.45666558385913,20,0.64,18,21,"robust_candidate","HSPG2","heparan sulfate proteoglycan 2 [Source:HGNC Symbol;Acc:HGNC:5273]","cell differentiation; angiogenesis; brain development; circulatory system development; negative regulation of angiogenesis; receptor-mediated endocytosis; inflammatory response; response to hypoxia; positive regulation of endothelial cell proliferation; lipid metabolic process; negative regulation of cell adhesion; smoothened signaling pathway; embryo implantation; negative regulation of cell population proliferation; response to xenobiotic stimulus; animal organ regeneration","extracellular space; extracellular region; focal adhesion; basement membrane; extracellular matrix; plasma membrane; Golgi lumen; neuron projection; lysosomal lumen; plasma membrane protein complex","protein binding; calcium ion binding; metal ion binding; amyloid-beta binding; low-density lipoprotein particle receptor binding; extracellular matrix structural constituent conferring compression resistance",FALSE,FALSE,TRUE,FALSE,1,"extracellular",5
"Q08431","MFGE8",2.35691253763335,0.000362962488891334,4,0,0.373891147685226,24,0.66,24,26,"robust_candidate","MFGE8","milk fat globule EGF and factor V/VIII domain containing [Source:HGNC Symbol;Acc:HGNC:7036]","cell adhesion; angiogenesis; single fertilization; apoptotic cell clearance","extracellular region; extracellular space; membrane; cytoplasmic vesicle; acrosomal membrane; extracellular matrix; endoplasmic reticulum lumen; extracellular vesicle","extracellular matrix structural constituent; phosphatidylserine binding; integrin binding",TRUE,FALSE,TRUE,FALSE,2,"extracellular",64
"Q08722","CD47",0.976813900687574,0.0325607108953137,12,0,0.24228026971446,41,0.31,41,42,"robust_candidate","CD47","CD47 molecule [Source:HGNC Symbol;Acc:HGNC:1682]","positive regulation of cell-cell adhesion; positive regulation of inflammatory response; positive regulation of phagocytosis; apoptotic process; cell adhesion; angiogenesis; inflammatory response; positive regulation of cell population proliferation; positive regulation of immune system process; cell-cell adhesion; positive regulation of T cell activation; negative regulation of phagocytosis; regulation of nitric oxide biosynthetic process; integrin-mediated signaling pathway; cell migration; ATP export; cellular response to type II interferon; positive regulation of stress fiber assembly; heterotypic cell-cell adhesion; cellular response to interleukin-1; cellular response to interleukin-12; regulation of Fc receptor mediated stimulatory signaling pathway; positive regulation of monocyte extravasation","plasma membrane; membrane; specific granule membrane; tertiary granule membrane","protein binding; cell-cell adhesion mediator activity; protein binding involved in heterotypic cell-cell adhesion",FALSE,TRUE,TRUE,TRUE,3,"membrane",73
"Q13813","SPTAN1",0.483220684943696,0.170824112614418,8,1.24166666666667,0.153845704285591,58,0.46,57,59,"robust_candidate","SPTAN1","spectrin alpha, non-erythrocytic 1 [Source:HGNC Symbol;Acc:HGNC:11273]","actin filament capping; actin cytoskeleton organization; cytoskeleton organization","cytoplasm; cytoskeleton; microtubule cytoskeleton; plasma membrane; extracellular region; cell cortex; cortical actin cytoskeleton; cytosol; cell junction; membrane; specific granule lumen; tertiary granule lumen; extracellular vesicle; cell projection; spectrin","protein binding; calcium ion binding; metal ion binding; actin binding; calmodulin binding; structural constituent of cytoskeleton; cadherin binding; actin filament binding",TRUE,TRUE,TRUE,FALSE,3,"extracellular",1
"Q14103","HNRNPD",-2.66041495386855,0.0710203433165112,12,630.628735863619,0.444091393386107,21,0.59,20,23,"robust_candidate","HNRNPD","heterogeneous nuclear ribonucleoprotein D [Source:HGNC Symbol;Acc:HGNC:5036]","rhythmic process; positive regulation of macromolecule biosynthetic process; positive regulation of DNA-templated transcription; regulation of DNA-templated transcription; regulation of circadian rhythm; regulation of gene expression; regulation of mRNA stability; positive regulation of translation; positive regulation of transcription by RNA polymerase II; RNA catabolic process; RNA processing; CRD-mediated mRNA stabilization; negative regulation of nuclear-transcribed mRNA catabolic process, deadenylation-dependent decay; positive regulation of cytoplasmic translation; positive regulation of telomere capping; liver development; positive regulation of gene expression; negative regulation of gene expression; cerebellum development; response to estradiol; response to calcium ion; response to electrical stimulus; 3'-UTR-mediated mRNA destabilization; cellular response to amino acid stimulus; cellular response to estradiol stimulus; cellular response to nitric oxide; circadian regulation of translation; response to rapamycin; response to sodium phosphate; cellular response to putrescine; hepatocyte dedifferentiation; regulation of RNA metabolic process","nucleus; cytoplasm; nucleoplasm; ribonucleoprotein complex; chromatin; cytosol; mCRD-mediated mRNA stability complex; postsynaptic density; synapse; glutamatergic synapse","RNA binding; nucleic acid binding; DNA binding; protein binding; telomeric DNA binding; minor groove of adenine-thymine-rich DNA binding; chromatin binding; mRNA binding; mRNA 3'-UTR AU-rich region binding; histone deacetylase binding",FALSE,FALSE,FALSE,FALSE,0,"intracellular",11
"Q14204","DYNC1H1",0.184863940489038,0.488756911015193,10,101.02380952381,0.160069842880499,56,0.7,55,58,"robust_candidate","DYNC1H1","dynein cytoplasmic 1 heavy chain 1 [Source:HGNC Symbol;Acc:HGNC:2961]","microtubule-based movement; cell division; mitotic spindle organization; cytoplasmic microtubule organization; positive regulation of intracellular transport; nuclear migration; regulation of mitotic spindle organization; retrograde axonal transport; positive regulation of spindle assembly; P-body assembly; stress granule assembly; establishment of spindle localization; regulation of metaphase plate congression","dynein complex; cytoplasm; membrane; cytoskeleton; microtubule; centrosome; extracellular region; axon cytoplasm; cytoplasmic dynein complex; cytosol; cytoplasmic microtubule; cell cortex; azurophil granule lumen; filopodium","ATP binding; ATP hydrolysis activity; dynein light intermediate chain binding; RNA binding; nucleotide binding; protein binding; identical protein binding",FALSE,TRUE,FALSE,FALSE,1,"extracellular",2
"Q14240","EIF4A2",0.288161805463993,0.645345560609303,6,0.5,0.0941329968490236,66,0.31,65,66,"robust_candidate","EIF4A2","eukaryotic translation initiation factor 4A2 [Source:HGNC Symbol;Acc:HGNC:3284]","translation; translational initiation; regulation of translational initiation; cytoplasmic translational initiation; cellular response to leukemia inhibitory factor; negative regulation of RNA-dependent RNA polymerase activity","cytosol; perinuclear region of cytoplasm","ATP binding; nucleic acid binding; RNA helicase activity; RNA binding; hydrolase activity; nucleotide binding; protein binding; helicase activity; translation initiation factor activity; ATP hydrolysis activity",FALSE,FALSE,FALSE,FALSE,0,"intracellular",0
"Q15185","PTGES3",0.498961498046647,0.470752272774601,8,26.1190476190476,0.162915926183631,55,0.73,54,57,"robust_candidate","PTGES3","prostaglandin E synthase 3 [Source:HGNC Symbol;Acc:HGNC:16049]","telomere maintenance via telomerase; lipid metabolic process; fatty acid metabolic process; prostaglandin biosynthetic process; fatty acid biosynthetic process; prostaglandin metabolic process; protein folding; telomere maintenance; chaperone-mediated protein complex assembly; signal transduction; protein stabilization; telomerase holoenzyme complex assembly; prostanoid biosynthetic process","nucleus; cytoplasm; chromosome, telomeric region; nucleoplasm; cytosol; protein folding chaperone complex; telomerase holoenzyme complex; protein-containing complex","Hsp90 protein binding; isomerase activity; protein binding; prostaglandin-E synthase activity; unfolded protein binding; protein-folding chaperone binding; telomerase activity",FALSE,FALSE,FALSE,FALSE,0,"intracellular",0
"Q15366","PCBP2",0.491318411631759,0.687436296610755,6,0,0.107712479933986,63,0.52,61,63,"robust_candidate","PCBP2","poly(rC) binding protein 2 [Source:HGNC Symbol;Acc:HGNC:8648]","defense response to virus; immune system process; innate immune response; regulation of transcription by RNA polymerase II; proteasome-mediated ubiquitin-dependent protein catabolic process; negative regulation of defense response to virus; viral RNA genome replication; mRNA metabolic process; cGAS/STING signaling pathway; negative regulation of cGAS/STING signaling pathway; IRES-dependent viral translational initiation","nucleus; cytoplasm; membrane; cytosol; nucleoplasm; focal adhesion; ribonucleoprotein complex","RNA binding; nucleic acid binding; enzyme binding; DNA binding; protein binding; ubiquitin protein ligase binding; mRNA binding; single-stranded DNA binding",FALSE,FALSE,TRUE,FALSE,1,"intracellular",4
"Q9Y230","RUVBL2",0.198600308993019,0.726050198640517,56,130.514386836521,0.269369716735172,40,1.3,36,40,"robust_candidate","RUVBL2","RuvB like AAA ATPase 2 [Source:HGNC Symbol;Acc:HGNC:10475]","DNA repair; DNA damage response; chromatin organization; negative regulation of DNA-templated transcription; positive regulation of transcription by RNA polymerase II; regulation of transcription by RNA polymerase II; chromatin remodeling; DNA recombination; regulation of DNA replication; cellular response to UV; positive regulation of double-strand break repair via homologous recombination; negative regulation of canonical Wnt signaling pathway; regulation of DNA strand elongation; establishment of protein localization to chromatin; regulation of chromosome organization; protein stabilization; regulation of DNA repair; positive regulation of DNA-templated transcription; regulation of DNA-templated transcription; protein folding; regulation of apoptotic process; cellular response to estradiol stimulus; regulation of embryonic development; regulation of cell cycle; regulation of double-strand break repair; telomere maintenance; positive regulation of DNA repair; positive regulation of telomere maintenance in response to DNA damage; box C/D snoRNP assembly; telomerase RNA localization to Cajal body","nucleus; cytoplasm; membrane; cytosol; nucleoplasm; centrosome; ciliary basal body; nucleosome; NuA4 histone acetyltransferase complex; MLL1 complex; protein folding chaperone complex; RPAP3/R2TP/prefoldin-like complex; Ino80 complex; Swr1 complex; euchromatin; R2TP complex; ribonucleoprotein complex","ATP binding; ATP hydrolysis activity; ATP-dependent activity, acting on DNA; hydrolase activity; nucleotide binding; protein binding; identical protein binding; helicase activity; transcription corepressor activity; RNA polymerase II cis-regulatory region sequence-specific DNA binding; beta-catenin binding; DNA helicase activity; chromatin DNA binding; unfolded protein binding; RNA polymerase II core promoter sequence-specific DNA binding; TFIID-class transcription factor complex binding; protein homodimerization activity; ADP binding; ATPase binding",FALSE,FALSE,FALSE,FALSE,0,"intracellular",0
"Q9Y265","RUVBL1",0.273586231404206,0.640775003789487,60,190.629818669713,0.286354631311035,37,1.69,32,38,"weight_sensitive_candidate","RUVBL1","RuvB like AAA ATPase 1 [Source:HGNC Symbol;Acc:HGNC:10474]","cell division; DNA repair; DNA damage response; chromatin organization; regulation of transcription by RNA polymerase II; DNA recombination; regulation of DNA replication; positive regulation of double-strand break repair via homologous recombination; chromatin remodeling; telomere maintenance; regulation of DNA repair; positive regulation of DNA repair; regulation of embryonic development; regulation of DNA strand elongation; positive regulation of telomere maintenance in response to DNA damage; positive regulation of canonical Wnt signaling pathway; protein stabilization; positive regulation of DNA-templated transcription; spermatogenesis; regulation of DNA-templated transcription; regulation of apoptotic process; regulation of cell cycle; regulation of double-strand break repair; regulation of chromosome organization; box C/D snoRNP assembly; telomerase RNA localization to Cajal body","nucleus; cytoplasm; nuclear speck; membrane; cytosol; nucleoplasm; cytoskeleton; ciliary basal body; centrosome; nucleosome; NuA4 histone acetyltransferase complex; MLL1 complex; protein folding chaperone complex; RPAP3/R2TP/prefoldin-like complex; ribonucleoprotein complex; Ino80 complex; Swr1 complex; R2TP complex","ATP binding; ATP hydrolysis activity; ATP-dependent activity, acting on DNA; hydrolase activity; nucleotide binding; protein binding; helicase activity; transcription coactivator activity; TFIID-class transcription factor complex binding; ADP binding; ATPase binding; DNA helicase activity; cadherin binding",FALSE,FALSE,FALSE,FALSE,0,"intracellular",0
"Q9Y266","NUDC",-0.0166273068367495,0.97540075271597,4,3.61904761904762,0.0507463271412047,72,0,72,72,"robust_candidate","NUDC","nuclear distribution C, dynein complex regulator [Source:HGNC Symbol;Acc:HGNC:8045]","cell division; protein folding; mitotic metaphase chromosome alignment; mitotic spindle organization; establishment of organelle localization; nuclear migration; response to peptide hormone","cytoplasm; nucleus; cytosol; cytoskeleton; microtubule; spindle; midbody; mitotic spindle; nucleoplasm","protein binding; cadherin binding; unfolded protein binding",FALSE,TRUE,FALSE,FALSE,1,"intracellular",0
